{
  "format": "rhythm-dojo-chart",
  "version": 3,
  "song": {
    "id": "0349e961-3846-4eb0-bf80-63209e44e6e4",
    "title": "PUPA",
    "artist": "モリモリあつし",
    "audio": null
  },
  "timing": {
    "audioOffsetSeconds": 0.0,
    "tempoPoints": [
      {
        "timeSeconds": 0.0,
        "bpm": 202.0
      }
    ],
    "grid": {
      "originSeconds": 0.4833333333333334,
      "meters": [
        {
          "timeSeconds": 0.0,
          "numerator": 4,
          "denominator": 4
        }
      ]
    }
  },
  "charts": [
    {
      "id": "77c2be0e-b25c-4544-888f-e30a94d3d895",
      "name": "Standard",
      "modeId": "FourLaneMode",
      "laneCount": 4,
      "completionTimeSeconds": 131.5410625,
      "notes": [
        {
          "kind": "tap",
          "lane": 1,
          "timeSeconds": 0.4833333333333334
        },
        {
          "kind": "tap",
          "lane": 1,
          "timeSeconds": 0.6333333333333333
        },
        {
          "kind": "tap",
          "lane": 0,
          "timeSeconds": 0.7833333333333334
        },
        {
          "kind": "tap",
          "lane": 2,
          "timeSeconds": 0.7833333333333334
        },
        {
          "kind": "tap",
          "lane": 3,
          "timeSeconds": 0.9333333333333333
        },
        {
          "kind": "tap",
          "lane": 3,
          "timeSeconds": 1.0833333333333333
        },
        {
          "kind": "tap",
          "lane": 1,
          "timeSeconds": 1.2333333333333332
        },
        {
          "kind": "tap",
          "lane": 2,
          "timeSeconds": 1.2333333333333332
        },
        {
          "kind": "tap",
          "lane": 0,
          "timeSeconds": 1.3833333333333335
        },
        {
          "kind": "tap",
          "lane": 0,
          "timeSeconds": 1.5166666666666668
        },
        {
          "kind": "tap",
          "lane": 1,
          "timeSeconds": 1.6666666666666667
        },
        {
          "kind": "tap",
          "lane": 3,
          "timeSeconds": 1.6666666666666667
        },
        {
          "kind": "tap",
          "lane": 2,
          "timeSeconds": 2.8499999999999996
        },
        {
          "kind": "tap",
          "lane": 2,
          "timeSeconds": 3.0
        },
        {
          "kind": "tap",
          "lane": 1,
          "timeSeconds": 3.166666666666666
        },
        {
          "kind": "tap",
          "lane": 3,
          "timeSeconds": 3.166666666666666
        },
        {
          "kind": "tap",
          "lane": 0,
          "timeSeconds": 3.3
        },
        {
          "kind": "tap",
          "lane": 0,
          "timeSeconds": 3.45
        },
        {
          "kind": "tap",
          "lane": 1,
          "timeSeconds": 3.6166666666666663
        },
        {
          "kind": "tap",
          "lane": 2,
          "timeSeconds": 3.6166666666666663
        },
        {
          "kind": "tap",
          "lane": 3,
          "timeSeconds": 3.75
        },
        {
          "kind": "tap",
          "lane": 3,
          "timeSeconds": 3.8999999999999995
        },
        {
          "kind": "tap",
          "lane": 0,
          "timeSeconds": 4.05
        },
        {
          "kind": "tap",
          "lane": 2,
          "timeSeconds": 4.05
        },
        {
          "kind": "tap",
          "lane": 1,
          "timeSeconds": 5.233333333333333
        },
        {
          "kind": "tap",
          "lane": 1,
          "timeSeconds": 5.383333333333333
        },
        {
          "kind": "tap",
          "lane": 0,
          "timeSeconds": 5.533333333333333
        },
        {
          "kind": "tap",
          "lane": 2,
          "timeSeconds": 5.533333333333333
        },
        {
          "kind": "tap",
          "lane": 3,
          "timeSeconds": 5.683333333333334
        },
        {
          "kind": "tap",
          "lane": 3,
          "timeSeconds": 5.833333333333333
        },
        {
          "kind": "tap",
          "lane": 1,
          "timeSeconds": 5.983333333333333
        },
        {
          "kind": "tap",
          "lane": 2,
          "timeSeconds": 5.983333333333333
        },
        {
          "kind": "tap",
          "lane": 0,
          "timeSeconds": 6.133333333333333
        },
        {
          "kind": "tap",
          "lane": 0,
          "timeSeconds": 6.283333333333333
        },
        {
          "kind": "tap",
          "lane": 1,
          "timeSeconds": 6.433333333333334
        },
        {
          "kind": "tap",
          "lane": 3,
          "timeSeconds": 6.433333333333334
        },
        {
          "kind": "tap",
          "lane": 2,
          "timeSeconds": 7.616666666666666
        },
        {
          "kind": "tap",
          "lane": 2,
          "timeSeconds": 7.766666666666667
        },
        {
          "kind": "tap",
          "lane": 1,
          "timeSeconds": 7.916666666666667
        },
        {
          "kind": "tap",
          "lane": 3,
          "timeSeconds": 7.916666666666667
        },
        {
          "kind": "tap",
          "lane": 0,
          "timeSeconds": 8.05
        },
        {
          "kind": "tap",
          "lane": 0,
          "timeSeconds": 8.200000000000001
        },
        {
          "kind": "tap",
          "lane": 1,
          "timeSeconds": 8.350000000000001
        },
        {
          "kind": "tap",
          "lane": 2,
          "timeSeconds": 8.350000000000001
        },
        {
          "kind": "tap",
          "lane": 3,
          "timeSeconds": 8.516666666666667
        },
        {
          "kind": "tap",
          "lane": 3,
          "timeSeconds": 8.65
        },
        {
          "kind": "hold",
          "lane": 0,
          "timeSeconds": 8.8,
          "endTimeSeconds": 9.166666666666668
        },
        {
          "kind": "tap",
          "lane": 2,
          "timeSeconds": 8.8
        },
        {
          "kind": "tap",
          "lane": 2,
          "timeSeconds": 9.25
        },
        {
          "kind": "tap",
          "lane": 1,
          "timeSeconds": 9.316666666666668
        },
        {
          "kind": "tap",
          "lane": 2,
          "timeSeconds": 9.4
        },
        {
          "kind": "tap",
          "lane": 1,
          "timeSeconds": 9.466666666666667
        },
        {
          "kind": "tap",
          "lane": 2,
          "timeSeconds": 9.533333333333333
        },
        {
          "kind": "tap",
          "lane": 1,
          "timeSeconds": 9.616666666666667
        },
        {
          "kind": "tap",
          "lane": 2,
          "timeSeconds": 9.683333333333334
        },
        {
          "kind": "tap",
          "lane": 1,
          "timeSeconds": 9.766666666666667
        },
        {
          "kind": "tap",
          "lane": 2,
          "timeSeconds": 9.833333333333334
        },
        {
          "kind": "tap",
          "lane": 1,
          "timeSeconds": 9.916666666666668
        },
        {
          "kind": "hold",
          "lane": 3,
          "timeSeconds": 9.983333333333334,
          "endTimeSeconds": 10.200000000000001
        },
        {
          "kind": "tap",
          "lane": 1,
          "timeSeconds": 10.283333333333333
        },
        {
          "kind": "tap",
          "lane": 2,
          "timeSeconds": 10.283333333333333
        },
        {
          "kind": "tap",
          "lane": 3,
          "timeSeconds": 10.583333333333334
        },
        {
          "kind": "tap",
          "lane": 1,
          "timeSeconds": 10.733333333333334
        },
        {
          "kind": "tap",
          "lane": 2,
          "timeSeconds": 10.8
        },
        {
          "kind": "tap",
          "lane": 1,
          "timeSeconds": 10.883333333333335
        },
        {
          "kind": "tap",
          "lane": 0,
          "timeSeconds": 11.033333333333333
        },
        {
          "kind": "tap",
          "lane": 3,
          "timeSeconds": 11.333333333333334
        },
        {
          "kind": "tap",
          "lane": 0,
          "timeSeconds": 11.483333333333334
        },
        {
          "kind": "tap",
          "lane": 1,
          "timeSeconds": 11.616666666666667
        },
        {
          "kind": "tap",
          "lane": 2,
          "timeSeconds": 11.766666666666667
        },
        {
          "kind": "tap",
          "lane": 0,
          "timeSeconds": 11.916666666666668
        },
        {
          "kind": "tap",
          "lane": 3,
          "timeSeconds": 12.0
        },
        {
          "kind": "tap",
          "lane": 0,
          "timeSeconds": 12.066666666666668
        },
        {
          "kind": "tap",
          "lane": 3,
          "timeSeconds": 12.216666666666667
        },
        {
          "kind": "tap",
          "lane": 2,
          "timeSeconds": 12.366666666666667
        },
        {
          "kind": "tap",
          "lane": 1,
          "timeSeconds": 12.516666666666667
        },
        {
          "kind": "tap",
          "lane": 0,
          "timeSeconds": 12.816666666666668
        },
        {
          "kind": "tap",
          "lane": 1,
          "timeSeconds": 12.966666666666667
        },
        {
          "kind": "tap",
          "lane": 2,
          "timeSeconds": 13.100000000000001
        },
        {
          "kind": "tap",
          "lane": 1,
          "timeSeconds": 13.25
        },
        {
          "kind": "tap",
          "lane": 2,
          "timeSeconds": 13.333333333333334
        },
        {
          "kind": "tap",
          "lane": 1,
          "timeSeconds": 13.4
        },
        {
          "kind": "tap",
          "lane": 3,
          "timeSeconds": 13.55
        },
        {
          "kind": "tap",
          "lane": 0,
          "timeSeconds": 13.700000000000001
        },
        {
          "kind": "tap",
          "lane": 1,
          "timeSeconds": 13.850000000000001
        },
        {